{
  "tld": "cx",
  "registry": "cxDA",
  "country": {
    "code": "country_code",
    "state": "country_state",
    "city": "country_city"
  },
  "fields": {
    "domain_name": "domain_name",
    "registrant": "registrant",
    "registrant_name": "registrant_name", 
    "registrar": "registrar",
    "emails": null,
    "creation_date": "creation_date",
    "expiration_date": "expiration_date",
    "updated_date": "updated_date",
    "name_servers": "name_servers",
    "status": "status"
  }
}
