{
  "tld": "cc",
  "registry": "VeriSign",
  "country": {
    "code": "country",
    "state": "state",
    "city": "city"
  },
  "fields": {
    "domain_name": "domain_name",
    "registrant": "org",
    "registrant_name": "name", 
    "registrar": "registrar",
    "emails": "emails",
    "creation_date": "creation_date",
    "expiration_date": "expiration_date",
    "updated_date": {
      "source": "updated_date",
      "normalize": "last" 
    },
    "name_servers": "name_servers",
    "status": "status"
  }
}
